002B19			002B		002B19	<a href="http://refcode.inist.fr">http://refcode.inist.fr</a>	<a href="http://udcdata.info/039706">Pathologie du système lymphatique, des organes hématopoïétiques, du système endocrinien</a>	HEMOPATHIES	HEMATOLOGIC AND HEMATOPOIETIC DISEASES	L'hémopathie désigne les maladies du sang qui touchent les érythrocytes, les leucocytes et les plaquettes. Le terme hémopathie est né au xixe siècle et est composé des racines grecques hémo = sang et de -pathie, tiré du grec pathos, « ce qu'on éprouve ». Source: <a href="https://fr.wikipedia.org/wiki/Hémopathie">https://fr.wikipedia.org/wiki/Hémopathie</a>	Maladies des hématies. Leucémies. Lymphomes malins. Réticuloses malignes. Hématodermies. Splénomégalie myéloïde. Maladies des thrombocytes et coagulopathies. Autres maladies. Hémopathies et pathologie générale.	http://udcdata.info/039706	<a href="http://udcdata.info/039706">Pathologie du système lymphatique, des organes hématopoïétiques, du système endocrinien</a>	8/4/2016		Istex	Lodex team
002B20			002B		002B20	<a href="http://refcode.inist.fr">http://refcode.inist.fr</a>	<a href="http://udcdata.info/040374">Gynaecology. Obstetrics</a>	GYNECOLOGIE. ANDROLOGIE. OBSTETRIQUE	GYNECOLOGY. ANDROLOGY. OBSTETRICS	1)La gynécologie Composé de gynéco- (du grec ancien γυνή, gyné, « femme ») et de -logie (λόγος, logos, « discours ») (étymologiquement science, étude de la femme) est une spécialité médico-chirurgicale qui s'occupe de la physiologie et des affections du système génital de la femme.  2)L'andrologie (du grec andros, homme) est la spécialité médicale qui s'occupe de la santé masculine, en particulier pour les problèmes de l'appareil reproducteur masculin et les problèmes urologiques particuliers aux individus mâles.  3)L'obstétrique est une spécialité médico-chirurgicale qui a pour objet l'étude et la prise en charge de la grossesse et de l'accouchement.   Sources: <a href="https://fr.wikipedia.org/wiki/Gynécologie">https://fr.wikipedia.org/wiki/Gynécologie</a> ; <a href="https://fr.wikipedia.org/wiki/Andrologie">https://fr.wikipedia.org/wiki/Andrologie</a> ; <a href="https://fr.wikipedia.org/wiki/Obstétrique">https://fr.wikipedia.org/wiki/Obstétrique</a>	Régulation des naissances. Pathologie de l'appareil génital mâle. Pathologie de l'appareil génital femelle. Pathologie des deux sexes. Dysgénésies gonadiques. Hermaphrodisme. Résistance tissu cible hormones sexuelles. Pathologie de la glande mammaire. Gestation. Foetus. Placenta. Accouchement. Postpartum. Lactation. Troubles de la puberté, ménopause, andropause.	http://udcdata.info/040374	<a href="http://udcdata.info/040374">Gynaecology. Obstetrics</a>	8/4/2016		Istex	Lodex team
002B21			002B		002B21	<a href="http://refcode.inist.fr">http://refcode.inist.fr</a>	<a href="http://udcdata.info/037318">Medical sciences</a>	ENDOCRINOPATHIES	ENDOCRINOPATHIES	Les affections endocriniennes comprennent non seulement les pathologies s'accompagnant d'une sécrétion exagérée (hypersécrétion hormonale) d'hormone mais également celles se caractérisant par une insuffisance de sécrétion d'hormone (hyposécrétion hormonale). Source:  <a href="http://www.vulgaris-medical.com/encyclopedie-medicale/endocrinopathie">http://www.vulgaris-medical.com/encyclopedie-medicale/endocrinopathie</a>	Hypothalamus. Hypophyse. Epiphyse (pathologie). Surrénale. Axe surrénalien. Système rénin-angiotensine (pathologie). Thyroïde. Axe thyroïdien (pathologie). Parathyroïde. Cellules parafolliculaires. Cholécalciférol. Homéostasie phosphocalcique (pathologie). Pancréas endocrine. cellules APUD (pathologie). Prostaglandines (pathologie). Généralités. Endocrinopathies associées. Syndromes endocriniens paranéoplasiques.	http://udcdata.info/037318	<a href="http://udcdata.info/037318">Medical sciences</a>	8/4/2016		Istex	Lodex team
002B22			002B		002B22	<a href="http://refcode.inist.fr">http://refcode.inist.fr</a>	<a href="http://udcdata.info/039330">Microbial physics, chemistry, metabolism, catabolism</a>	MALADIES METABOLIQUES	METABOLIC DISEASES	Une maladie métabolique est un trouble médical qui affecte les métabolismes dans la cellule, en particulier la production d'énergie. Source: <a href="https://fr.wikipedia.org/wiki/Maladie_métabolique">https://fr.wikipedia.org/wiki/Maladie_métabolique</a>	Dyslipémies. Hyperlipoprotéinémies. Obésité. Autres maladies métaboliques liées à l'alimentation (malnutrition, carences alimentaires et vitaminiques...). Maladies métaboliques héréditaires et congénitales. Autres maladies métaboliques.	http://udcdata.info/039330	<a href="http://udcdata.info/039330">Microbial physics, chemistry, metabolism, catabolism</a>	8/4/2016		Istex	Lodex team
002B23			002B		002B23	<a href="http://refcode.inist.fr">http://refcode.inist.fr</a>	<a href="http://udcdata.info/034918">General genetics. General cytogenetics</a>	GENETIQUE MEDICALE	MEDICAL GENETICS	La génétique médicale est la spécialité médicale qui étudie l'hérédité chez les individus et les causes génétiques des maladies. Source: <a href="https://fr.wikipedia.org/wiki/Génétique_médicale">https://fr.wikipedia.org/Génétique_médicale</a>	Conseil génétique. Aberrations chromosomiques. Fragilité chromosomique (syndrome de Bloom, ataxie télangiectasie, anémie de Fanconi, arriération mentale liée à l'X...). Maladies mentales et troubles du comportement. Syndromes complexes.	http://udcdata.info/034918	<a href="http://udcdata.info/034918">General genetics. General cytogenetics</a>	8/4/2016		Istex	Lodex team
002B24			002B		002B24	<a href="http://refcode.inist.fr">http://refcode.inist.fr</a>	<a href="http://udcdata.info/034918">General genetics. General cytogenetics</a>	TECHNIQUES D'EXPLORATION ET DE DIAGNOSTIC (GENERALITES)	INVESTIGATIVE TECHNIQUES, DIAGNOSTIC TECHNIQUES (GENERAL ASPECTS)		Radiodiagnostic. Imagerie RMN. Spectrométrie RMN. Exploration radioisotopique. Exploration par ultrasons. Electrodiagnostic. Enregistrement des activités électriques. Endoscopie. Exploration hémodynamique. Exploration fonctionnelle ORL (larynx, voix, audiométrie, vestibulométrie, équilibration...). Exploration fonctionnelle respiratoire. Exploration fonctionnelle rénale et des voies urinaires. Exploration fonctionnelle de l'appareil digestif. Exploration de la fonction oculaire et visuelle. Liquide céphalorachidien (biochimie, cytologie, circulation, mesure de la pression). Mesure de la pression intracrânienne. Coagulation sanguine. Explorations fonctionnelles en endocrinologie et reproduction. Anatomopathologie. Exploration cytologique. Biochimie. Spectrométries. Méthodes cliniques et paracliniques diverses.	http://udcdata.info/037318	<a href="http://udcdata.info/034918">General genetics. General cytogenetics</a>	8/4/2016		Istex	Lodex team
002B25			002B		002B25	<a href="http://refcode.inist.fr">http://refcode.inist.fr</a>	<a href="http://udcdata.info/040245">Surgery. Orthopaedics. Ophthalmology</a>	CHIRURGIE (GENERALITES). TRANSPLANTATIONS, GREFFES D'ORGANES ET DE TISSUS. PATHOLOGIE DES GREFFONS	SURGERY (GENERAL ASPECTS). TRANSPLANTATIONS, ORGAN AND TISSUE GRAFTS. GRAFT DISEASES		Chirurgie plastique cutanée. Chirurgie ophtalmologique. Chirurgie ORL et maxillofaciale. Chirurgie dentaire. Orthodontie. Chirurgie de l'appareil respiratoire. Chirurgie cardiaque. Chirurgie vasculaire: aorte, membres, veine cave. Chirurgie des lymphatiques. Chirurgie de l'appareil digestif. Chirurgie de l'appareil urinaire. Chirurgie orthopédique. Chirurgie du système nerveux. Chirurgie de l'appareil génital et de la glande mammaire. Chirurgie des glandes endocrines. Technologie. Biomatériaux. Equipements. Chirurgie combinée. Transplantations multiples. 	http://udcdata.info/040245	<a href="http://udcdata.info/040245">Surgery. Orthopaedics. Ophthalmology</a>	8/4/2016		Istex	Lodex team
002B26			002B		002B26	<a href="http://refcode.inist.fr">http://refcode.inist.fr</a>	<a href="http://udcdata.info/038711">Physiotherapy. Physical therapy. Radiotherapy. Other nonmedicinal therapeutic treatment</a>	RADIOTHERAPIE. TRAITEMENT INSTRUMENTAL. PHYSIOTHERAPIE. REEDUCATION. READAPTATION, ORTHOPHONIE, CRENOTHERAPIE. TRAITEMENT DIETETIQUE ET TRAITEMENTS DIVERS (GENERALITES)	RADIOTHERAPY. INSTRUMENTAL TREATMENT. PHYSIOTHERAPY. REEDUCATION. REHABILITATION, ORTHOPHONY, CRENOTHERAPY. DIET THERAPY AND VARIOUS OTHER TREATMENTS (GENERAL ASPECTS)	1)La radiothérapie est une méthode de traitement locorégional des cancers, utilisant des radiations pour détruire les cellules cancéreuses en bloquant leur capacité à se multiplier. 2)La physiothérapie est une discipline de la santé de première ligne intervenant au niveau de la prévention et de la promotion de la santé, de l’évaluation, du diagnostic, du traitement et de la réadaptation des déficiences et incapacités touchant les systèmes neurologique, musculosquelettique et cardiorespiratoire de la personne. 3)L'orthophonie (ortho : « correct », phonè : « voix »), ou logopédie (logos : « parole », paideia : « éducation ») en Belgique et en Suisse, est un champ d'expertise spécialisé dans l'évaluation et le traitement des troubles de la communication liés à la voix, à la parole et au langage oral et écrit. 4)L'ensemble des techniques et savoirs mis en œuvre lors d'une cure thermale s’appelle la crénothérapie.   Sources: <a href="https://fr.wikipedia.org/wiki/Radiothérapie">https://fr.wikipedia.org/Radiothérapie</a> ; <a href="https://fr.wikipedia.org/wiki/Physiothérapie">https://fr.wikipedia.org/Physiothérapie</a>  ; <a href="https://fr.wikipedia.org/wiki/Cure_thermale">https://fr.wikipedia.org/Cure_thermale</a>	Maladies cutanées. Cosmétiques. Maladies oculaires. ORL et stomatologie. Maladies de l'appareil respiratoire. Maladies cardiovasculaires. Maladies de l'appareil digestif. Maladies de l'appareil urinaire. Maladies du système ostéoarticulaire. Traitement orthopédique. Maladies du système nerveux. Hémopathies. Appareil génital. Glande mammaire. Glandes endocrines. Technologie. Biomatériaux. Equipements. Matériel. Appareillage. 	http://udcdata.info/038711	<a href="http://udcdata.info/038711">Physiotherapy. Physical therapy. Radiotherapy. Other nonmedicinal therapeutic treatment</a>	8/4/2016		Istex	Lodex team
002B27			002B		002B27	<a href="http://refcode.inist.fr">http://refcode.inist.fr</a>	<a href="http://udcdata.info/037318">Medical sciences</a>	ANESTHESIE. REANIMATION. TRANSFUSION. THERAPIE CELLULAIRE ET THERAPIE GENIQUE	ANESTHESIA. INTENSIVE CARE MEDICINE. TRANSFUSIONS. CELL THERAPY AND GENE THERAPY	1)Dans le cadre des « biothérapies », la thérapie cellulaire vise à soigner un organe ou un organisme par l'apport de cellules, obtenues la plupart du temps à partir de cellules souches, pour remplacer ou suppléer des cellules défaillantes.  2)La thérapie génique ou génothérapie est une stratégie thérapeutique qui consiste à faire pénétrer des gènes dans les cellules ou les tissus d'un individu pour traiter une maladie.  Sources: <a href="https://fr.wikipedia.org/wiki/Thérapie_cellulaire">https://fr.wikipedia.org/Thérapie_cellulaire</a> ; <a href="https://fr.wikipedia.org/wiki/Thérapie_génique">https://fr.wikipedia.org/Thérapie_génique</a>	Anesthésie. Réanimation. Soins intensifs. Mort clinique. Soins palliatifs. Don et conservation organe. Transfusions. Complications. Accidents transfusionnels. Thérapie cellulaire et thérapie génique. 	http://udcdata.info/037318	<a href="http://udcdata.info/037318">Medical sciences</a>	8/4/2016		Istex	Lodex team
002B28			002B		002B28	<a href="http://refcode.inist.fr">http://refcode.inist.fr</a>	<a href="http://udcdata.info/026936">Probability. Mathematical statistics</a>	INFORMATIQUE, STATISTIQUE et MODELISATIONS BIOMEDICALES	COMPUTERIZED, STATISTICAL MEDICAL DATA PROCESSING AND MODELS IN BIOMEDICINE		Modèles et simulation. Aide à la décision médicale. Aide au diagnostic. Informatique médicale et enseignement. Gestion informatisée (dossier médical, fichiers, gestion hospitalière). Statistique médicale. Documentation médicale informatisée.	http://udcdata.info/026936	<a href="http://udcdata.info/026936">Probability. Mathematical statistics</a>	8/4/2016		Istex	Lodex team
002B29			002B		002B29	<a href="http://refcode.inist.fr">http://refcode.inist.fr</a>	<a href="http://udcdata.info/034840">Physical anthropology</a>	PHYSIOLOGIE HUMAINE APPLIQUEE A L'ETUDE DES POPULATIONS ET DES CONDITIONS DE VIE. ECOPHYSIOLOGIE HUMAINE	HUMAN PHYSIOLOGY APPLIED TO POPULATION STUDIES AND LIFE CONDITIONS. HUMAN ECOPHYSIOLOGY	La physiologie (du grec φύσις, phusis, la nature, et λόγος, logos, l'étude, la science) étudie le rôle, le fonctionnement et l'organisation mécanique, physique et biochimique des organismes vivants et de leurs composants (organes, tissus, cellules et organites cellulaires). La physiologie étudie également les interactions entre un organisme vivant et son environnement. L'étude de la physiologie humaine remonte à au moins 420 av. J.-C. avec Hippocrate. Source: <a href="https://fr.wikipedia.org/wiki/Physiologie">https://fr.wikipedia.org/Physiologie</a>	Anthropologie. Démographie. Enquêtes nutritionnelles. Ressources et besoins alimentaires. Physiologie appliquée.	http://udcdata.info/034840	<a href="http://udcdata.info/034840">Physical anthropology</a>	8/4/2016		Istex	Lodex team
002B30			002B		002B30	<a href="http://refcode.inist.fr">http://refcode.inist.fr</a>	<a href="http://udcdata.info/038030">Hygiene generally. Personal health and hygiene</a>	SANTE PUBLIQUE. HYGIENE-MEDECINE DU TRAVAIL	PUBLIC HEALTH. HYGIENE-OCCUPATIONAL MEDICINE	1)La santé publique peut être définie de diverses manières. On peut en effet la présenter comme « l'étude, d'une part, des déterminants physiques, psychosociaux et socioculturels de la santé de la population et d'autre part des actions en vue d'améliorer la santé de la population. » Ou encore, comme « une activité organisée de la société visant à promouvoir, à protéger, à améliorer et, le cas échéant, à rétablir la santé de personnes, de groupes ou de la population entière. » 2)La médecine du travail désigne en France, en Belgique et dans les autres pays qui ont adopté les particularités du système français, à la fois une spécialité médicale qui concerne la prévention des atteintes à la santé des travailleurs (accidents du travail, maladies professionnelles) et les Services de médecine du (ou de santé au) travail au sein desquels s'exerce cette spécialité.  Source: <a href="https://fr.wikipedia.org/wiki/Santé_publique">https://fr.wikipedia.org/Santé_publique</a> ; <a href="https://fr.wikipedia.org/wiki/Médecine_du_travail">https://fr.wikipedia.org/Médecine_du_travail</a>	Santé publique. Hygiène. Médecine du travail.	http://udcdata.info/038030	<a href="http://udcdata.info/038030">Hygiene generally. Personal health and hygiene</a>	8/4/2016		Istex	Lodex team
002B31			002B		002B31	<a href="http://refcode.inist.fr">http://refcode.inist.fr</a>	<a href="http://udcdata.info/015924">Social ethics. Duties to one`s fellow humans</a>	ETHIQUE		L’éthique (du grec ethos « caractère, coutume, mœurs ») est une discipline philosophique portant sur les jugements de valeur. L'éthique se définit telle une réflexion fondamentale sur laquelle la morale établira ses normes, ses limites et ses devoirs. Des domaines aussi divers que la biologie appliquée à la médecine, l’avortement, l’euthanasie, le génie génétique, le végétarisme, la vaccination, les soins, le décryptage du génome humain, la sécurité alimentaire, la psychologie culturelle, la santé reproductive, le traitement des troubles mentaux et du handicap, la chirurgie, le brevetage des découvertes médicales ou pharmaceutiques, les conflits d'intérêts chez les rédacteurs de normes de bonnes pratiques, ou encore la gestion du risque épidémique (ex VIH/SIDA) ou un Plan de crise pour une pandémie ou la préparation individuelle et collective à une éventuelle pandémie grippale (de type grippe aviaire ou H1N1) posent de nombreuses questions d’éthique. Source: <a href="https://fr.wikipedia.org/wiki/Éthique">https://fr.wikipedia.org/Éthique</a>		http://udcdata.info/015924	<a href="http://udcdata.info/015924">Social ethics. Duties to one`s fellow humans</a>	8/4/2016		Istex	Lodex team
SHS		Catégories INIST		519 et 520 et 521 et 522 et 523 et 524 et 525 et 526 et 527 et 529 et 530 et 531	SHS	<a href="http://refcode.inist.fr">http://refcode.inist.fr</a>	<a href="http://udcdata.info/018549">SOCIAL SCIENCES</a>	SCIENCES HUMAINES ET SOCIALES	SOCIAL AND HUMAN SCIENCES			http://udcdata.info/018549	<a href="http://udcdata.info/018549">SOCIAL SCIENCES</a>	8/4/2016		Istex	Lodex team
519			SHS		519	<a href="http://refcode.inist.fr">http://refcode.inist.fr</a>	<a href="http://udcdata.info/015164">PHILOSOPHY. PSYCHOLOGY</a>	PHILOSOPHIE	PHILOSOPHY	La philosophie, du grec ancien φιλοσοφία (composé de φιλεῖν, philein : « aimer » ; et de σοφία, sophia : « sagesse »), signifie littéralement : « l'amour de la sagesse ». C'est une activité et une discipline existant depuis l'Antiquité en Occident et en Orient, se présentant comme un questionnement, une interprétation et une réflexion sur le monde et l'existence humaine. Différents buts peuvent lui être attribués : la recherche de la vérité ; la méditation sur le bien, le beau, le juste ; la quête du sens de la vie et du bonheur. Source : <a href="https://fr.wikipedia.org/wiki/Philosophie">https://fr.wikipedia.org/Philosophie</a>	Etudes historiques (Histoire de la philosophie. Histoire des idées). Logique philosophique. Philosophie du langage. Epistémologie. Philosophie des sciences. Théorie de la connaissance. Philosophie générale. Métaphysique. Théorie des valeurs et Philosophie morale.Philosophie de l'action. Philosophie de l'histoire. Philosophie politique et sociale. Philosophie du droit. Philosophie de la religion. Philosophie de l'art. Esthétique. Esprit et corps. Identité personnelle. Philosophie de la culture. Anthropologie philosophique. Economie. Civilisation. Education.	http://udcdata.info/015164	<a href="http://udcdata.info/015164">PHILOSOPHY. PSYCHOLOGY</a>	8/4/2016		Istex	Lodex team
520			SHS		520	<a href="http://refcode.inist.fr">http://refcode.inist.fr</a>	<a href="http://udcdata.info/024974">Education</a>	SCIENCES DE L'EDUCATION	EDUCATIONAL SCIENCES	Les sciences de l’éducation concernent l’étude de différents aspects de l’éducation, et fait appel à diverses disciplines : histoire de l’éducation, sociologie de l’éducation, didactique des disciplines, psychologie des apprentissages, éducation comparée, administration scolaire, organisation et fonctionnement des systèmes éducatifs, politique de l'éducation, formation professionnelle et continue, formation du personnel de l'enseignement, enseignement spécialisé, ergonomie, etc. Source : <a href="https://fr.wikipedia.org/wiki/Sciences_de_l'éducation">https://fr.wikipedia.org/Sciences_de_l'éducation</a>	Histoire et philosophie de l'éducation. Education permanente et emploi. Recherche en éducation. Méthodes pédagogiques. Moyens d'enseignement. Personnel d'enseignement. Vie scolaire. Travail scolaire. Docimologie. Orientation. Inadaptation. Politique de l'éducation. Education et psychologie. Sociologie de l'éducation. Planification et économie de l'éducation. Organisation de l'enseignement.	http://udcdata.info/024974	<a href="http://udcdata.info/024974">Education</a>	8/4/2016		Istex	Lodex team
521			SHS		521	<a href="http://refcode.inist.fr">http://refcode.inist.fr</a>	<a href="http://udcdata.info/001930">SOCIAL SCIENCES</a>	SOCIOLOGIE	SOCIOLOGY	La sociologie peut être définie comme la branche des sciences humaines qui cherche à comprendre et à expliquer l'impact de la dimension sociale sur les représentations (façons de penser) et les comportements (façons d'agir) humains. Ses objets de recherche sont très variés puisque les sociologues s'intéressent à la fois au travail, à la famille, aux médias, aux relations, aux réseaux sociaux, aux rapports de genre (hommes/femmes), aux statuts et fonctions, aux religions, ou encore aux formes de cultures et d'ethnicités… Source : <a href="https://fr.wikipedia.org/wiki/Sociologie">https://fr.wikipedia.org/Sociologie</a>	Organisation sociale. Système social. Structure sociale. Ecologie humaine et démographie. Sociologie rurale et urbaine. Cultures et civilisations. Sociologie de la religion. Sociologie de la famille. Groupes d'âge. Sociologie de l'éducation. Systèmes scolaires. Education permanente. Sociologie juridique et criminelle. Sociologie politique. Sociologie économique et du développement. Sociologie du travail et des organisations. Sociologie de la connaissance et de la culture. Sociologie de la médecine. Problèmes sociaux et politique sociale. Travail social. Sociologie du corps. Genre. Sociologie du risque et des catastrophes. Psychosociologie.	http://udcdata.info/018549	<a href="http://udcdata.info/001930">SOCIAL SCIENCES</a>	8/4/2016		Istex	Lodex team
522			SHS		522	<a href="http://refcode.inist.fr">http://refcode.inist.fr</a>	<a href="http://udcdata.info/001930">SOCIAL SCIENCES</a>	HISTOIRE DES SCIENCES ET DES TECHNIQUES	HISTORY OF SCIENCE AND TECHNOLOGY	L'histoire des sciences est l’étude de l'évolution de la connaissance scientifique. Source :  <a href="https://fr.wikipedia.org/wiki/Histoire_des_sciences">https://fr.wikipedia.org/Histoire_des_sciences</a>	Sciences et techniques de la terre. Sciences et techniques de la vie. Sciences et techniques mathématiques. Sciences et techniques physiques.	http://udcdata.info/001930	<a href="http://udcdata.info/001930">SOCIAL SCIENCES</a>	8/4/2016		Istex	Lodex team
523			SHS		523	<a href="http://refcode.inist.fr">http://refcode.inist.fr</a>	<a href="http://udcdata.info/067278">General questions relating to both linguistics and literature. Philology</a>	HISTOIRE ET SCIENCES DE LA LITTERATURE	HISTORY AND SCIENCES OF LITTERATURE	Le mot littérature, issu du latin litteratura dérivé de littera (la lettre), apparaît au début du xiie siècle avec un sens technique de « chose écrite » puis évolue à la fin du Moyen Âge vers le sens de « savoir tiré des livres », avant d'atteindre aux xviie ‑ xviiie siècles son sens principal actuel : ensemble des œuvres écrites ou orales comportant une dimension esthétique. Source : <a href="https://fr.wikipedia.org/wiki/Littérature">https://fr.wikipedia.org/Littérature</a>	Histoire de la littérature. Sciences de la littérature.	http://udcdata.info/067278	<a href="http://udcdata.info/067278">General questions relating to both linguistics and literature. Philology</a>	8/4/2016		Istex	Lodex team
524			SHS		524	<a href="http://refcode.inist.fr">http://refcode.inist.fr</a>	<a href="http://udcdata.info/067362">Linguistics and languages</a>	LINGUISTIQUE	LINGUISTICS	La linguistique est la discipline s’intéressant à l’étude du langage. Elle se distingue de la grammaire, dans la mesure où elle n'est pas prescriptive mais descriptive. La prescription correspond à la norme, c'est-à-dire ce qui est jugé correct linguistiquement par les grammairiens. À l'inverse, la linguistique descriptive des linguistes se contente de décrire la langue telle qu'elle est et non telle qu'elle devrait être. Source : <a href="https://fr.wikipedia.org/wiki/Linguistique">https://fr.wikipedia.org/Linguistique</a>	Biologie du langage. Psycholinguistique. Sociolinguistique et ethnolinguistique. Comparaison et classification des langues. Diachronie et linguistique historique . Histoire de la linguistique. Pathologie du langage. Epistémologie et méthodologie. Philosophie du langage et logique. Théorie linguistique. Linguistique et mathématiques. Sémiotique. 	http://udcdata.info/067362	<a href="http://udcdata.info/067362">Linguistics and languages</a>	8/4/2016		Istex	Lodex team
525			SHS		525	<a href="http://refcode.inist.fr">http://refcode.inist.fr</a>	<a href="http://udcdata.info/077137">Archaeology. Prehistory. Cultural remains. Area studies</a>	PREHISTOIRE ET PROHISTOIRE	PREHISTORY AND PROTOHISTORY	La Préhistoire est généralement définie comme la période comprise entre l’apparition de l’humanité et l’apparition des premiers documents écrits, même si cette définition n’est pas sans poser des problèmes. Elle se divise en deux parties : Le Paléolithique (l'âge de la pierre taillée) et le Néolithique (l'âge de la pierre polie). Source : https://fr.wikipedia.org/wiki/Préhistoire    Le terme « Protohistoire » renvoie à plusieurs notions distinctes : d'une part, il a un sens épistémologique et désigne « la science qui regroupe l'ensemble des connaissances sur les peuples sans écriture contemporains des premières civilisations historiques ». L'étude de ces peuples se caractérise donc par l'impossibilité d'exploiter des sources écrites indigènes (inexistantes) et par la possibilité de s'appuyer sur des textes émanant d’autres peuples contemporains ; d'autre part, il a un sens chronologique en désignant en Europe et en Asie centrale la période correspondant au Néolithique et aux âges des métaux : Âge du cuivre, Âge du bronze et Âge du fer. Source : <a href="https://fr.wikipedia.org/wiki/Protohistoire">https://fr.wikipedia.org/Protohistoire</a>	Asie. Afrique. Amérique er régions arctiques. Océanie. Europe.	http://udcdata.info/077137	<a href="http://udcdata.info/077137">Archaeology. Prehistory. Cultural remains. Area studies</a>	8/4/2016		Istex	Lodex team
