002A11			002A		002A11	<a href="http://refcode.inist.fr">http://refcode.inist.fr</a>	<a href="http://udcdata.info/034523"</a>	PROTOZOAIRES	PROTOZOA	En biologie, le terme protozoaire (Protozoa, du grec ancien proto- (πρῶτος, prôtos « premier ») et zôon (ζῷον « animal ») désigne les protistes (eucaryotes unicellulaires) hétérotrophes qui ingèrent leur nourriture par phagocytose, contrairement aux deux autres types de protistes. Les Protozoaires étant souvent unicellulaires, ce sont toujours de petits organismes, approchant le millimètre pour les plus gros, mais pouvant s'associer en colonies, formant alors presque des superorganismes Ils vivent exclusivement dans l'eau ou dans les sols humides ou à l'intérieur d'un organisme (dans le mucus pulmonaire, l'intestin, la panse de certains animaux...). Source: <a href="https://fr.wikipedia.org/wiki/Protozoaire">https://fr.wikipedia.org/wiki/Protozoaire</a>	Systématique. Répartition géographique. Morphologie. Cytologie. Biochimie. Physiologie. Immunologie. Biologie moléculaire. Cycle évolutif. Relation hôte-agent. Pouvoir pathogène. Pathologie. Vaccins, immunsérums, immunoglobulines et anticorps monoclonaux thérapeutiques.	http://udcdata.info/034523	<a href="http://udcdata.info/034523"</a>	8/4/2016		Istex	Lodex team
002A12			002A		002A12	<a href="http://refcode.inist.fr">http://refcode.inist.fr</a>	<a href="http://udcdata.info/036304">Etude des organes animaux. Organologie animal. Anatomie animale. Zootomie</a>	INVERTEBRES	INVERTEBRATES	Un invertébré est un animal dépourvu decolonne vertébrale, et de fait d'os en général. Définis par oppositions aux vertébrés, les invertébrés peuvent avoir des plans d'organisations très différents et ne sont plus considérés comme un taxon pertinent. Source: <a href="https://fr.wikipedia.org/wiki/Invertébré">https://fr.wikipedia.org/wiki/Invertébré</a>	Porifera. Cnidaria. Ctenaria. Nemathelminthia. Plathelmintha. Annelida et embranchements voisins: Sipuncula. Echiura. Nemertinea. Mollusca. Arachnida. Crustacea. Myriapoda. Insecta. Echinodermata. Groupes peu représentés ou d'affinité incertaine: Acanthocephala, Chaetognatha, Gnathostomulida, Lophophoria, Merostomata, Mesozoa, Myxozoa, Nematorhyncha, Pararthropoda, Placozoa, Priapuloidea, Prochordata, Pycnogonida	http://udcdata.info/036304	<a href="http://udcdata.info/036304">Etude des organes animaux. Organologie animal. Anatomie animale. Zootomie</a>	8/4/2016		Istex	Lodex team
002A13			002A		002A13	<a href="http://refcode.inist.fr">http://refcode.inist.fr</a>	<a href="http://udcdata.info/036284">Embryologie animale. Ontogénie animale. Développement des organismes individuels</a>	ETHOLOGIE ANIMALE	ANIMAL ETHOLOGY	L'éthologie est l'étude du comportement des diverses espèces animales, dans leur milieu naturel ou non. Cette branche zoologique de la biologie a été créée en 1854 par lenaturaliste Isidore Geoffroy Saint-Hilaire. Au niveau théorique, l'éthologie peut s'apparenter à la biologie du comportement et surtout à la biologie de l'interaction intraspécifique. Source: <a href="https://fr.wikipedia.org/wiki/Éthologie">https://fr.wikipedia.org/wiki/Éthologie</a>	Protozoa. Invertebrata. Vertebrata.	http://udcdata.info/036284	<a href="http://udcdata.info/036284">Embryologie animale. Ontogénie animale. Développement des organismes individuels</a>	8/4/2016		Istex	Lodex team
002A14			002A		002A14	<a href="http://refcode.inist.fr">http://refcode.inist.fr</a>	<a href="http://udcdata.info/037319">Human biology</a>	ECOLOGIE ANIMALE, VEGETALE ET MICROBIENNE	ANIMAL, PLANT AND MICROBIAL ECOLOGY	1)L'écologie, également connue sous les noms de bioécologie, bionomie ou science de l'environnement ou environnementale, est la science qui étudie les êtres vivants dans leur milieu et les interactions entre eux.                                   2)L'écologie végétale est une sous-discipline de l'écologie qui s'intéresse aux relations des végétaux entre eux et avec leur environnement (=leur habitat, ou encore biotope).                               3)L'écologie microbienne consiste à caractériser la biodiversité microbienne d'un écosystème, à caractériser les interactions entre micro-organismes (chaînes trophiques), à identifier le rôle des micro-organismes dans l'écosystème, à étudier les interactions hôtes-microorganismes (symbiose, commensalisme, parasitisme, ... Sources : <a href="https://fr.wikipedia.org/wiki/Écologie">https://fr.wikipedia.org/wiki/Écologie</a> ; <a href="https://fr.wikipedia.org/wiki/Écologie_végétale">https://fr.wikipedia.org/wiki/Écologie_végétale</a> ; <a href="https://fr.wikipedia.org/wiki/Écologie_microbienne">https://fr.wikipedia.org/wiki/Écologie_microbienne</a>	Ecologie animale et végétale. Autoécologie. Démécologie. Synécologie.  Ecologie microbienne. Milieux divers (espace extraatmosphérique, air, eau). Microflore normale de l'homme et des animaux. Rumen. Sol. Microflore des végétaux.                                                                   Ecologie appliquée.	http://udcdata.info/037319	<a href="http://udcdata.info/037319">Human biology</a>	8/4/2016		Istex	Lodex team
002A15			002A		002A15	<a href="http://refcode.inist.fr">http://refcode.inist.fr</a>	<a href="http://udcdata.info/036153">Zoologie</a>	VERTEBRES: ZOOLOGIE GENERALE, MORPHOLOGIE, PHYLOGENESE, SYSTEMATIQUE, CYTOGENETIQUE, REPARTITION GEOGRAPHIQUE	VERTEBRATES: GENERAL ZOOLOGY, MORPHOLOGY, PHYLOGENY, SYSTEMATICS, CYTOGENETICS, GEOGRAPHICAL DISTRIBUTION	Les Vertébrés (Vertebrata) forment unsous-embranchement du règne animal. Cetaxon (groupe monophylétique) est également un clade (groupeholophylétique). Il appartient à l'embranchement des Chordés, appartenant eux-mêmes au rameau desdeutérostomiens. Source: <a href="https://fr.wikipedia.org/wiki/Vertébrés">https://fr.wikipedia.org/wiki/Vertébrés</a>	Agnatha. Pisces. Amphibia. Reptilia. Aves. Mammalia. 	http://udcdata.info/036153	<a href="http://udcdata.info/036153">Zoologie</a>	8/4/2016		Istex	Lodex team
002A16			002A		002A16	<a href="http://refcode.inist.fr">http://refcode.inist.fr</a>	<a href="http://udcdata.info/036163">Physiologie animale</a>	VERTEBRES: ANATOMIE ET PHYSIOLOGIE, ORGANISME DANS SON ENSEMBLE OU ETUDE DE PLUSIEURS ORGANES OU SYSTEMES	VERTEBRATES: ANATOMY AND PHYSIOLOGY, STUDIES ON BODY, SEVERAL ORGANS OR SYSTEMS	La caractéristique la plus intuitive des Vertébrés est qu'ils possèdent un squelette osseux ou cartilagineux interne, qui comporte en particulier une colonne vertébrale, composée de vertèbres qui protègent la partie troncale du système nerveux central. D'autres caractères partagés et exclusifs sont : la présence de 5 vésicules céphaliques lors de la formation de l'encéphale. la présence de crêtes neurales Source: <a href="https://fr.wikipedia.org/wiki/Vertébrés">https://fr.wikipedia.org/wiki/Vertébrés</a>	Développement. Métamorphose. Mue. Sénescence. Dégénérescence. Régénération. Cicatrisation. Greffe. Métabolismes et régulations neurohumorales. Alimentation. Comportement alimentaire. Chronobiologie. Thermorégulation. Hibernation. Estivation. Ecophysiologie et facteurs ambiants.	http://udcdata.info/036163	<a href="http://udcdata.info/036163">Physiologie animale</a>	8/4/2016		Istex	Lodex team
002A17			002A		002A17	<a href="http://refcode.inist.fr">http://refcode.inist.fr</a>	<a href="http://udcdata.info/036163">Physiologie animale</a>	VERTEBRES: SYSTEME DIGESTIF	VERTEBRATES: DIGESTIVE SYSTEM	Le système digestif, appelé aussi appareil digestif, est l'ensemble des organes qui chez les animaux a pour rôle d'assurer l'ingestion et la digestion des aliments pour en extraire l'énergie et les nutriments nécessaires à la survie de l'organisme qui sont ensuite absorbés par l'organisme. Ce système est essentiel à la vie des animaux et se retrouve nécessairement pour toutes les espèces. Le rôle de ce système biologique est également d'assurer l'excrétion des matières alimentaires qui n'ont pu être absorbées par l'organisme. Source: <a href="https://fr.wikipedia.org/wiki/Appareil_digestif">https://fr.wikipedia.org/wiki/Appareil_digestif</a>	Cavité buccale. Glandes salivaires, exocrines et endocrines. Dents. Oesophage. Estomac. Intestin. Mésentère. Hormones gastrointestinales. Foie. Bile. Voies biliaires. Pancréas exocrine.	http://udcdata.info/036163	<a href="http://udcdata.info/036163">Physiologie animale</a>	8/4/2016		Istex	Lodex team
002A18			002A		002A18	<a href="http://refcode.inist.fr">http://refcode.inist.fr</a>	<a href="http://udcdata.info/036163">Physiologie animale</a>	VERTEBRES: SYSTEME URINAIRE	VERTEBRATES: URINARY SYSTEM	L’appareil urinaire est l’appareil permettant l’évacuation des produits du catabolisme du corps humain sous une forme liquide, l'urine, et assure par conséquent l'épuration du sang ainsi que le maintien de l'homéostasie au sein de l'organisme. Aussi, il maintient l'équilibre sanguin, soit le volume et la composition chimique du sang. Pour ce faire il élimine entre autres les surplus des certains minéraux, nommésélectrolytes, et renvoie dans le sang les substances utiles au bon fonctionnement de l'organisme. Chaque jour, un être humain produit 800 à 2000 mililitres d'urine. L'appareil urinaire fait partie du système excréteur. Source: <a href="https://fr.wikipedia.org/wiki/Appareil_urinaire">https://fr.wikipedia.org/wiki/Appareil_urinaire</a>		http://udcdata.info/036163	<a href="http://udcdata.info/036163">Physiologie animale</a>	8/4/2016		Istex	Lodex team
002A19			002A		002A19	<a href="http://refcode.inist.fr">http://refcode.inist.fr</a>	<a href="http://udcdata.info/036163">Physiologie animale</a>	VERTEBRES: PEAU, GLANDES ANNEXES, PHANERES, ORGANES LUMINEUX, GLANDES EXOCRINES DIVERSES (GLANDE A SEL, GLANDE UROPYGIENNE ETC.), TISSU ADIPEUX, TISSU CONJONCTIF	VERTEBRATES: SKIN, ASSOCIATED GLANDS, PHANERES, LIGHT ORGANS, VARIOUS EXOCRINE GLANDS (SALT GLAND, UROPYGIAL GLAND...), ADIPOSE TISSUE, CONNECTIVE TISSUE	1)Les glandes sudoripares ou sudorales sont des organes spécialisés (en l'occurrence des glandes) qui sécrètent la sueur et, pour certaines d'entre elles, des hormones ou phéromones.  2)La glande sébacée est une glande intradermique, annexée au poil, sécrétant le sébum qui limite le dessèchement de la peau, joue un rôle bactéricide et lubrifie le poil.  3)Les phanères sont des productions issues de l'épiderme. Chez l'Homme, les principaux phanères sont les cheveux, les poils, et les ongles.  4)La bioluminescence est la production et l'émission de lumière par un organisme vivant résultant d'une réaction chimique au cours de laquelle l'énergie chimique est convertie en énergie lumineuse.         Une glande exocrine est une glande qui sécrète des substances destinées à être expulsées dans le milieu extérieur de l'organisme.  5)Le tissu adipeux (masse grasse) est un tissu conjonctif contenant des cellules graisseuses, appelées « adipocytes ».  6)Les tissus conjonctifs sont des tissus dont les cellules sont séparées par une matrice extracellulaire. Ils constituent la majorité de la masse du corps des animaux. Ils sont impliqués dans de multiples fonctions de soutien, de protection, de nutrition, de liaison, de réparation des tissus, de mouvement, de réponse immunitaire, de croissance et de stockage. Sources: <a href="https://fr.wikipedia.org/wiki/Glande_sudoripare">https://fr.wikipedia.org/wiki/Glande_sudoripare</a> ; <a href="https://fr.wikipedia.org/wiki/Glande_sébacée">https://fr.wikipedia.org/wiki/Glande_sébacée</a> ; <a href="https://fr.wikipedia.org/wiki/Phanère">https://fr.wikipedia.org/wiki/Phanère</a> ; <a href="https://fr.wikipedia.org/wiki/Tissu_adipeux">https://fr.wikipedia.org/wiki/Tissu_adipeux</a> ; <a href="https://fr.wikipedia.org/wiki/Tissu_conjonctif">https://fr.wikipedia.org/wiki/Tissu_conjonctif</a>		http://udcdata.info/036163	<a href="http://udcdata.info/036163">Physiologie animale</a>	8/4/2016		Istex	Lodex team
002A20			002A		002A20	<a href="http://refcode.inist.fr">http://refcode.inist.fr</a>	<a href="http://udcdata.info/036163">Physiologie animale</a>	VERTEBRES: SYSTÈME RESPIRATOIRE	VERTEBRATES: RESPIRATORY SYSTEM	L'appareil respiratoire est l'appareil (ensemble d'organes), qui permet la respiration, c'est-à-dire les échanges gazeux entre l'organisme et l'environnement. Chez les animaux, la respiration désigne à la fois les mécanismes qui permettent les transferts de gaz entre l'organisme et l'environnement (absorption de dioxygène O2 et rejet de dioxyde de carbone CO2) et la respiration cellulaire (dégradation du glucose grâce au dioxygène pour fournir de l'énergie). Source: <a href="https://fr.wikipedia.org/wiki/Appareil_respiratoire">https://fr.wikipedia.org/wiki/Appareil_respiratoire</a>	Appareil respiratoire: anatomie, métabolisme, échanges gazeux, mécanique ventilatoire, hémodynamique respiratoire. Contrôle cardiorespiratoire. Mécano- et chimiorécepteurs artériels. Gaz sanguins. Hémoglobine. Myoglobine. Echanges gazeux hémotissulaires. Equilibre acidobasique.	http://udcdata.info/036163	<a href="http://udcdata.info/036163">Physiologie animale</a>	8/4/2016		Istex	Lodex team
002A21			002A		002A21	<a href="http://refcode.inist.fr">http://refcode.inist.fr</a>	<a href="http://udcdata.info/036163">Physiologie animale</a>	VERTEBRES: SANG, ORGANES HEMATOPOIETIQUES, SYSTÈME RETICULO-ENDOTHELIAL	VERTEBRATES: BLOOD, HEMATOPOIETIC ORGANS, RETICULOENDOTHELIAL SYSTEM	1)Le sang est un liquide biologique vital qui circule continuellement dans les vaisseaux sanguins et le cœur, notamment grâce à la pompe cardiaque. Il est composé d'un fluide aqueux, le plasma, et de milliards de cellules, principalement les globules rouges, qui lui donnent sa couleur.  2)L'hématopoïèse (du Grec αἷμα, αίματος : "le sang" et ποιεῖν : faire, fabriquer) désigne le processus physiologique de production des cellules sanguines ou bien éléments figurés du sang. 3)Le système réticulo-endothélial possède des éléments mobiles : les monocytes et des éléments fixes : les macrophages du tissu conjonctif, les cellules réticulaires des organes hématopoiétiques (moelle osseuse, ganglions lymphatiques, rate, thymus, organes lymphoïdes divers dispersés dans le tube digestif et ailleurs), les cellules endothéliales et les cellules littorales, qui leur sont associées. Les cellules du système réticulo-endothélial jouent un grand rôle dans les phagocytoses des globules rouges (G.R.) vieillis ou des débris de G.R. (rôle assez dominant dans la rate). C'est dans le système réticulo-endothélial que se produit la transformation de l'hémoglobine en bilirubine.  Sources: <a href="https://fr.wikipedia.org/wiki/Sang">https://fr.wikipedia.org/wiki/Sang</a> ; <a href="https://fr.wikipedia.org/wiki/Hématopoïèse">https://fr.wikipedia.org/wiki/Hématopoïèse</a> ; <a href="https://fr.wikipedia.org/wiki/Système_réticulo-endothélial">https://fr.wikipedia.org/wiki/Système_réticulo-endothélial</a>		http://udcdata.info/036163	<a href="http://udcdata.info/036163">Physiologie animale</a>	8/4/2016		Istex	Lodex team
002A22			002A		002A22	<a href="http://refcode.inist.fr">http://refcode.inist.fr</a>	<a href="http://udcdata.info/036163">Physiologie animale</a>	VERTEBRES: SYSTÈME CARDIOVASCULAIRE	VERTEBRATES: CARDIOVASCULAR SYSTEM	Le système sanguin ou appareil cardiovasculaire est un type de système circulatoire en circuit fermé qui assure le transport du sang du cœur vers les extrémités et les divers organes, et en retour de ceux-ci vers le cœur. Source: <a href="https://fr.wikipedia.org/wiki/Appareil_cardiovasculaire">https://fr.wikipedia.org/wiki/Appareil_cardiovasculaire</a>	Hémodynamique. Rhéologie. Cœur. Vaisseaux sanguins et récepteurs. Système lymphatique.	http://udcdata.info/036163	<a href="http://udcdata.info/036163">Physiologie animale</a>	8/4/2016		Istex	Lodex team
002A23			002A		002A23	<a href="http://refcode.inist.fr">http://refcode.inist.fr</a>	<a href="http://udcdata.info/036163">Physiologie animale</a>	VERTEBRES: SYSTÈME OSTEOARTICULAIRE, MUSCLE STRIE	VERTEBRATES: OSTEOARTICULAR SYSTEM, MUSCULOSKELETAL SYSTEM	1)Ostéoarticulaire : Qui se rapporte à une pathologie ou une infection qui touche simultanément l'os et l'articulation. 2)Le muscle strié est un tissu musculaire caractérisé par la présence de stries en microscopie, du fait de l'organisation régulière des filaments.  Source: <a href="http://www.linternaute.com/dictionnaire/fr/definition/osteoarticulaire">http://www.linternaute.com/dictionnaire/fr/definition/osteoarticulaire</a> ; <a href="https://fr.wikipedia.org/wiki/Muscle_stri%C3%A9">https://fr.wikipedia.org/wiki/Muscle_stri%C3%A9</a>	Squelette et articulations. Muscle strié. Tendons. 	http://udcdata.info/036163	<a href="http://udcdata.info/036163">Physiologie animale</a>	8/4/2016		Istex	Lodex team
002A24			002A		002A24	<a href="http://refcode.inist.fr">http://refcode.inist.fr</a>	<a href="http://udcdata.info/036163">Physiologie animale</a>	VERTEBRES: MOUVEMENTS CORPORELS. POSTURE. LOCOMOTION. VOL. NAGE. EXERCICE PHYSIQUE. REPOS. SPORTS	VERTEBRATES: BODY MOVEMENT. POSTURE. LOCOMOTION. FLIGHT. SWIMMING. PHYSICAL EXERCISE. REST. SPORTS			http://udcdata.info/036163	<a href="http://udcdata.info/036163">Physiologie animale</a>	8/4/2016		Istex	Lodex team
002A25			002A		002A25	<a href="http://refcode.inist.fr">http://refcode.inist.fr</a>	<a href="http://udcdata.info/036163">Physiologie animale</a>	VERTEBRES: SYSTEME NERVEUX ET ORGANES DES SENS	VERTEBRATES: NERVOUS SYSTEM AND SENSE ORGANS	1)Le système nerveux est un système biologique animal responsable de la coordination des actions avec l'environnement extérieur et de la communication rapide entre les différentes parties du corps. Les êtres vivants dotés d'un système nerveux sont nommés eumétazoaires.  2)Un système sensoriel est une partie du système nerveux responsable de la sensation. Il regroupe les récepteurs sensoriels, les voies nerveuses, et les parties du cerveau responsables du traitement de l'information sensorielle. L'ensemble des systèmes sensoriels se divisent en sensibilité générale ou somesthésie et en sens dits spécifiques : la vision, l'odorat, le goût, l'ouïe et le toucher.   Sources: <a href="https://fr.wikipedia.org/wiki/Système_nerveux">https://fr.wikipedia.org/wiki/Système_nerveux</a> ; <a href="https://fr.wikipedia.org/wiki/Système_sensoriel">https://fr.wikipedia.org/wiki/Système_sensoriel</a>	Circulation cérébrale. Barrière hématoencéphalique. Plexus choroïde. Liquide céphalorachidien. Organe épendymaire. Méninges. Neurone et nerf isolés. Névroglie. Système nerveux central. Motricité et voies motrices. Réflexes. Centres de contrôle des fonctions végétatives. Système vestibulaire et équilibration. Somesthésie et voies somesthésiques (proprioception, extéroception, nociception); intéroception; électrolocation. Récepteurs sensoriels. Système nerveux périphérique. Système nerveux autonome. Transmission neuromusculaire. Transmission ganglionnaire. Organe électrique. Oreille et annexes. Voies et centres auditifs. Audition. Organe vocal. Phonation. Emissions sonores. Echolocation. Oeil et annexes. Voies et centres visuels. Vision. Appareil olfactif et olfaction. Appareil gustatif et gustation. Sommeil. Vigilance. Développement. Sénescence. Régénération. Transplantation.	http://udcdata.info/036163	<a href="http://udcdata.info/036163">Physiologie animale</a>	8/4/2016		Istex	Lodex team
002A26			002A		002A26	<a href="http://refcode.inist.fr">http://refcode.inist.fr</a>	<a href="http://udcdata.info/015381">Psychophysiologie (psychologie physiologique). Physiologie mentale</a>	PSYCHOLOGIE. PSYCHOPHYSIOLOGIE	PSYCHOLOGY. PSYCHOPHYSIOLOGY	1)La psychologie (du grec psukhê, âme, et logos, parole) est l'étude des faits psychiques, des comportements et desprocessus mentaux. C'est une discipline qui appartient à la catégorie des sciences humaines. Divisée en de nombreuses branches d’étude aussi bien théoriques que pratiques, la psychologie a des applications thérapeutiquesindividuelles ou collectives, sociales, et politiques ou morales. 2)Le mot psychophysiologie est un néologisme forgé sur le terme psychologie, comme étude des comportements et de la pensée, et physiologie, comme étude des lois du fonctionnement des organismes. La psychophysiologie se situe à l’interface de ces deux disciplines comme science des mécanismes et des lois physiologiques des comportements et de la pensée chez l’animal, dont l’homme.    Sources: <a href="https://fr.wikipedia.org/wiki/Psychologie">https://fr.wikipedia.org/wiki/Psychologie</a> ; <a href="https://fr.wikipedia.org/wiki/Psychophysiologie">https://fr.wikipedia.org/wiki/Psychophysiologie</a>	Psychométrie. Statistique. Méthodologie. Psychophysiologie du comportement. Niveaux d'activité. Psychomotricité. Perception. Processus d'acquisition. Mémoire. Personnalité. Affectivité. Cognition. Intelligence. Langage. Psychologie du développement. Psychologie de l'éducation. Psychologie du travail. Psychologie sociale. Psychologie et médecine. Psychologie différentielle et comparée. Psychologie appliquée. Parapsychologie.	http://udcdata.info/015381	<a href="http://udcdata.info/015381">Psychophysiologie (psychologie physiologique). Physiologie mentale</a>	8/4/2016		Istex	Lodex team
002A27			002A		002A27	<a href="http://refcode.inist.fr">http://refcode.inist.fr</a>	<a href="http://udcdata.info/015381">Psychophysiologie (psychologie physiologique). Physiologie mentale</a>	PSYCHANALYSE	PSYCHOANALYSIS	La psychanalyse est, selon la définition classique qu'en a donnée Sigmund Freud : un procédé d'investigation des processus psychiques, qui autrement sont à peine accessibles ; une méthode de traitement des troubles névrotiques ou psychotiques, qui se fonde sur cette investigation, également nommée la cure psychanalytique ; une série de conceptions ayant trait au psychisme, acquises par ces moyens et qui fusionnent progressivement en une discipline scientifique nouvelle. Source: <a href="https://fr.wikipedia.org/wiki/Psychanalyse">https://fr.wikipedia.org/wiki/Psychanalyse</a>	Cure psychanalytique. Théories psychanalytiques. Psychanalyse appliquée.	http://udcdata.info/015381	<a href="http://udcdata.info/015381">Psychophysiologie (psychologie physiologique). Physiologie mentale</a>	8/4/2016		Istex	Lodex team
002A28			002A		002A28	<a href="http://refcode.inist.fr">http://refcode.inist.fr</a>	<a href="http://udcdata.info/039706">Pathologie du système lymphatique, des organes hématopoïétiques, du système endocrinien</a>	VERTEBRES: ENDOCRINOLOGIE	VERTEBRATES: ENDOCRINOLOGY	L'endocrinologie est la science de la médecine qui étudie les hormones. Son nom signifie : l'étude (logos) de la sécrétion (crine) interne (endo). Elle étudie de très nombreux phénomènes physiologiques, car les hormones interviennent dans de nombreuses fonctions chez de nombreux organismes dont l'Homme. Source: <a href="https://fr.wikipedia.org/wiki/Endocrinologie">https://fr.wikipedia.org/wiki/Endocrinologie</a>	Hypothalamus. Hypophyse. Epiphyse. Urophyse. Surrénale. Interrénale. Rein endocrine. Système rénine-angiotensine-aldostérone. Thyroïde. Parathyroïde. Corps ultimobranchial. Pancréas endocrine. Cellules APUD. Hormones peptidiques et protéiques. Facteurs de croissance. Hormones stéroïdes. Dérivés du cholécalciférol. Prostaglandines. Dérivés de l'acide arachidonique.  Interactions hormonales. Activités hormonales sur plusieurs systèmes. Réactions adaptatives.	http://udcdata.info/039706	<a href="http://udcdata.info/039706">Pathologie du système lymphatique, des organes hématopoïétiques, du système endocrinien</a>	8/4/2016		Istex	Lodex team
002A29			002A		002A29	<a href="http://refcode.inist.fr">http://refcode.inist.fr</a>	<a href="http://udcdata.info/036163">Physiologie animale</a>	VERTEBRES: REPRODUCTION	VERTEBRATES: REPRODUCTION	En biologie, la reproduction est l'ensemble des processus par lesquels les individus existants engendrent de nouveaux individus capables à leur tour de se reproduire. Source: <a href="https://fr.wikipedia.org/wiki/Reproduction">https://fr.wikipedia.org/wiki/Reproduction</a>	Reproduction des vertébrés non mammifères. Reproduction des mammifères. Différenciation et maturation sexuelles. Puberté. Ménopause. Appareil génital mâle des mammifères. Appareil génital femelle des mammifères. Gestation. Mise bas. Lactation.	http://udcdata.info/036163	<a href="http://udcdata.info/036163">Physiologie animale</a>	8/4/2016		Istex	Lodex team
002A30			002A		002A30	<a href="http://refcode.inist.fr">http://refcode.inist.fr</a>	<a href="http://udcdata.info/037320">Anatomie. Anatomie humaine et comparée</a>	EMBRYOLOGIE: INVERTEBRES ET VERTEBRES. TERATOLOGIE	EMBRYOLOGY: INVERTEBRATES AND VERTEBRATES. TERATOLOGY	L'embryologie est une discipline scientifique qui englobe la description morphologique des transformations de l'œuf fécondé en organisme (embryologie morphologique) et l'étude de leur déterminisme (embryologie causale).                          La tératologie est la science des anomalies de l'organisation anatomique, congénitale et héréditaire, des êtres vivants. Source: <a href="https://fr.wikipedia.org/wiki/Embryologie">https://fr.wikipedia.org/wiki/Embryologie</a>	Premiers stades. Segmentation. Gastrulation. Neurulation. Organogenèse. Fonctions physiologiques. Embryologie moléculaire. Tératologie. Tératogènes.	http://udcdata.info/037320	<a href="http://udcdata.info/037320">Anatomie. Anatomie humaine et comparée</a>	8/4/2016		Istex	Lodex team
